ProcedureURN,ProcedureID,Active,Procedures,Description
14499,059A0ZZ	,1,DRAINAGE OF LEFT BRACHIAL VEIN; OPEN APPROACH	,NULL
14512,0H9U0ZZ	,1,DRAINAGE OF LEFT BREAST; OPEN APPROACH	,NULL
14514,0H9U3ZZ	,1,DRAINAGE OF LEFT BREAST; PERCUTANEOUS APPROACH	,NULL
14515,0H9U3ZX	,1,DRAINAGE OF LEFT BREAST; PERCUTANEOUS APPROACH; DIAGNOSTIC	,NULL
14520,0Y9100Z	,1,DRAINAGE OF LEFT BUTTOCK WITH DRAINAGE DEVICE; OPEN APPROACH	,NULL
14522,0Y910ZZ	,1,DRAINAGE OF LEFT BUTTOCK; OPEN APPROACH	,NULL
14523,0Y913ZZ	,1,DRAINAGE OF LEFT BUTTOCK; PERCUTANEOUS APPROACH	,NULL
14524,0Y913ZX	,1,DRAINAGE OF LEFT BUTTOCK; PERCUTANEOUS APPROACH; DIAGNOSTIC	,NULL
14554,059F00Z	,1,DRAINAGE OF LEFT CEPHALIC VEIN WITH DRAINAGE DEVICE; OPEN APPROACH	,NULL
14557,059F0ZZ	,1,DRAINAGE OF LEFT CEPHALIC VEIN; OPEN APPROACH	,NULL
14558,059F0ZX	,1,DRAINAGE OF LEFT CEPHALIC VEIN; OPEN APPROACH; DIAGNOSTIC	,
14559,059F3ZZ	,1,DRAINAGE OF LEFT CEPHALIC VEIN; PERCUTANEOUS APPROACH	,NULL
14606,069D30Z	,1,DRAINAGE OF LEFT COMMON ILIAC VEIN WITH DRAINAGE DEVICE; PERCUTANEOUS APPROACH	,
14656,0X9C3ZX	,1,DRAINAGE OF LEFT ELBOW REGION; PERCUTANEOUS APPROACH; DIAGNOSTIC	,
14662,0V9K0ZZ	,1,DRAINAGE OF LEFT EPIDIDYMIS; OPEN APPROACH	,NULL
14665,0V9K3ZX	,1,DRAINAGE OF LEFT EPIDIDYMIS; PERCUTANEOUS APPROACH; DIAGNOSTIC	,NULL
14734,09910ZZ	,1,DRAINAGE OF LEFT EXTERNAL EAR; OPEN APPROACH	,NULL
14736,09913ZZ	,1,DRAINAGE OF LEFT EXTERNAL EAR; PERCUTANEOUS APPROACH	,NULL
14737,09913ZX	,1,DRAINAGE OF LEFT EXTERNAL EAR; PERCUTANEOUS APPROACH; DIAGNOSTIC	,NULL
14774,0891XZZ	,1,DRAINAGE OF LEFT EYE; EXTERNAL APPROACH	,NULL
14801,049L30Z	,1,DRAINAGE OF LEFT FEMORAL ARTERY WITH DRAINAGE DEVICE; PERCUTANEOUS APPROACH	,NULL
14809,0Y9800Z	,1,DRAINAGE OF LEFT FEMORAL REGION WITH DRAINAGE DEVICE; OPEN APPROACH	,NULL
14810,0Y9830Z	,1,DRAINAGE OF LEFT FEMORAL REGION WITH DRAINAGE DEVICE; PERCUTANEOUS APPROACH	,NULL
14814,0Y983ZZ	,1,DRAINAGE OF LEFT FEMORAL REGION; PERCUTANEOUS APPROACH	,
14827,069N00Z	,1,DRAINAGE OF LEFT FEMORAL VEIN WITH DRAINAGE DEVICE; OPEN APPROACH	,NULL
14828,069N30Z	,1,DRAINAGE OF LEFT FEMORAL VEIN WITH DRAINAGE DEVICE; PERCUTANEOUS APPROACH	,NULL
14830,069N0ZZ	,1,DRAINAGE OF LEFT FEMORAL VEIN; OPEN APPROACH	,
14832,069N3ZZ	,1,DRAINAGE OF LEFT FEMORAL VEIN; PERCUTANEOUS APPROACH	,
14891,0H9NXZZ	,1,DRAINAGE OF LEFT FOOT SKIN; EXTERNAL APPROACH	,NULL
14892,0H9NXZX	,1,DRAINAGE OF LEFT FOOT SKIN; EXTERNAL APPROACH; DIAGNOSTIC	,NULL
14895,0J9R0ZZ	,1,DRAINAGE OF LEFT FOOT SUBCUTANEOUS TISSUE AND FASCIA; OPEN APPROACH	,NULL
14896,0J9R0ZX	,1,DRAINAGE OF LEFT FOOT SUBCUTANEOUS TISSUE AND FASCIA; OPEN APPROACH; DIAGNOSTIC	,
14897,0J9R3ZZ	,1,DRAINAGE OF LEFT FOOT SUBCUTANEOUS TISSUE AND FASCIA; PERCUTANEOUS APPROACH	,
14918,0Y9N30Z	,1,DRAINAGE OF LEFT FOOT WITH DRAINAGE DEVICE; PERCUTANEOUS APPROACH	,NULL
14920,0Y9N0ZZ	,1,DRAINAGE OF LEFT FOOT; OPEN APPROACH	,NULL
14921,0Y9N0ZX	,1,DRAINAGE OF LEFT FOOT; OPEN APPROACH; DIAGNOSTIC	,NULL
14922,0Y9N3ZX	,1,DRAINAGE OF LEFT FOOT; PERCUTANEOUS APPROACH; DIAGNOSTIC	,
14925,0Y9N3ZZ	,1,DRAINAGE OF LEFT FOOT;( PERCUTANEOUS ),NULL
14962,0H9GXZX	,1,DRAINAGE OF LEFT HAND ABSCESS; DIAGNOSTIC	,NULL
14966,039F0ZZ	,1,DRAINAGE OF LEFT HAND ARTERY; OPEN APPROACH	,NULL
14990,0H9GX0Z	,1,DRAINAGE OF LEFT HAND SKIN WITH DRAINAGE DEVICE; EXTERNAL APPROACH	,NULL
14991,0H9GXZZ	,1,DRAINAGE OF LEFT HAND SKIN; EXTERNAL APPROACH	,NULL
15016,0X9K30Z	,1,DRAINAGE OF LEFT HAND WITH DRAINAGE DEVICE; PERCUTANEOUS APPROACH	,NULL
15018,0X9K0ZZ	,1,DRAINAGE OF LEFT HAND; OPEN APPROACH	,NULL
15019,0X9K0ZX	,1,DRAINAGE OF LEFT HAND; OPEN APPROACH; DIAGNOSTIC	,NULL
15020,0X9K3ZZ	,1,DRAINAGE OF LEFT HAND; PERCUTANEOUS APPROACH	,NULL
15024,0F9600Z	,1,DRAINAGE OF LEFT HEPATIC DUCT WITH DRAINAGE DEVICE; OPEN APPROACH	,NULL
15025,0F9630Z	,1,DRAINAGE OF LEFT HEPATIC DUCT WITH DRAINAGE DEVICE; PERCUTANEOUS APPROACH	,NULL
15049,0S9B30Z	,1,DRAINAGE OF LEFT HIP JOINT WITH DRAINAGE DEVICE; PERCUTANEOUS APPROACH	,
15053,0S9B3ZZ	,1,DRAINAGE OF LEFT HIP JOINT; PERCUTANEOUS APPROACH	,
15057,0K9P00Z	,1,DRAINAGE OF LEFT HIP MUSCLE WITH DRAINAGE DEVICE; OPEN APPROACH	,
15058,0K9P30Z	,1,DRAINAGE OF LEFT HIP MUSCLE WITH DRAINAGE DEVICE; PERCUTANEOUS APPROACH	,NULL
15059,0K9P40Z	,1,DRAINAGE OF LEFT HIP MUSCLE WITH DRAINAGE DEVICE; PERCUTANEOUS ENDOSCOPIC APPROACH	,
15060,0K9P0ZZ	,1,DRAINAGE OF LEFT HIP MUSCLE; OPEN APPROACH	,NULL
15061,0K9P0ZX	,1,DRAINAGE OF LEFT HIP MUSCLE; OPEN APPROACH; DIAGNOSTIC	,
15062,0K9P3ZZ	,1,DRAINAGE OF LEFT HIP MUSCLE; PERCUTANEOUS APPROACH	,NULL
15063,0K9P3ZX	,1,DRAINAGE OF LEFT HIP MUSCLE; PERCUTANEOUS APPROACH; DIAGNOSTIC	,NULL
15085,0P9G30Z	,1,DRAINAGE OF LEFT HUMERAL SHAFT WITH DRAINAGE DEVICE; PERCUTANEOUS APPROACH	,NULL
15111,079J30Z	,1,DRAINAGE OF LEFT INGUINAL LYMPH NODE; PERCUTANEOUS,NULL
15123,0Y960ZZ	,1,DRAINAGE OF LEFT INGUINAL REGION; OPEN APPROACH	,NULL
15124,0Y960ZX	,1,DRAINAGE OF LEFT INGUINAL REGION; OPEN APPROACH; DIAGNOSTIC	,
15125,0Y963ZZ	,1,DRAINAGE OF LEFT INGUINAL REGION; PERCUTANEOUS APPROACH	,NULL
15126,0Y963ZX	,1,DRAINAGE OF LEFT INGUINAL REGION; PERCUTANEOUS APPROACH; DIAGNOSTIC	,
15189,0T9400Z	,1,DRAINAGE OF LEFT KIDNEY PELVIS WITH DRAINAGE DEVICE; OPEN APPROACH	,NULL
15190,0T9430Z	,1,DRAINAGE OF LEFT KIDNEY PELVIS WITH DRAINAGE DEVICE; PERCUTANEOUS APPROACH	,NULL
15191,0T9440Z	,1,DRAINAGE OF LEFT KIDNEY PELVIS WITH DRAINAGE DEVICE; PERCUTANEOUS ENDOSCOPIC APPROACH	,NULL
15193,0T9480Z	,1,DRAINAGE OF LEFT KIDNEY PELVIS WITH DRAINAGE DEVICE; VIA NATURAL OR ARTIFICIAL OPENING ENDOSCOPIC	,
15196,0T943ZZ	,1,DRAINAGE OF LEFT KIDNEY PELVIS; PERCUTANEOUS APPROACH	,NULL
15203,0T9100Z	,1,DRAINAGE OF LEFT KIDNEY WITH DRAINAGE DEVICE; OPEN APPROACH	,NULL
15204,0T9130Z	,1,DRAINAGE OF LEFT KIDNEY WITH DRAINAGE DEVICE; PERCUTANEOUS APPROACH	,NULL
15205,0T9170Z	,1,DRAINAGE OF LEFT KIDNEY WITH DRAINAGE DEVICE; VIA NATURAL OR ARTIFICIAL OPENING	,NULL
15206,0T910ZZ	,1,DRAINAGE OF LEFT KIDNEY; OPEN APPROACH	,NULL
15207,0T910ZX	,1,DRAINAGE OF LEFT KIDNEY; OPEN APPROACH; DIAGNOSTIC	,
15208,0T913ZZ	,1,DRAINAGE OF LEFT KIDNEY; PERCUTANEOUS APPROACH	,NULL
15209,0T913ZX	,1,DRAINAGE OF LEFT KIDNEY; PERCUTANEOUS APPROACH; DIAGNOSTIC	,NULL
15210,0T914ZZ	,1,DRAINAGE OF LEFT KIDNEY; PERCUTANEOUS ENDOSCOPIC APPROACH	,NULL
15211,0T914ZX	,1,DRAINAGE OF LEFT KIDNEY; PERCUTANEOUS ENDOSCOPIC APPROACH; DIAGNOSTIC	,NULL
15213,0T918ZZ	,1,DRAINAGE OF LEFT KIDNEY; VIA NATURAL OR ARTIFICIAL OPENING ENDOSCOPIC	,NULL
15214,0T918ZX	,1,DRAINAGE OF LEFT KIDNEY; VIA NATURAL OR ARTIFICIAL OPENING ENDOSCOPIC; DIAGNOSTIC	,NULL
15228,0S9D0ZZ	,1,DRAINAGE OF LEFT KNEE JOINT; OPEN APPROACH	,NULL
15230,0S9D3ZZ	,1,DRAINAGE OF LEFT KNEE JOINT; PERCUTANEOUS APPROACH	,NULL
15231,0S9D3ZX	,1,DRAINAGE OF LEFT KNEE JOINT; PERCUTANEOUS APPROACH; DIAGNOSTIC	,NULL
15237,0Y9G0ZZ	,1,DRAINAGE OF LEFT KNEE REGION; OPEN APPROACH	,NULL
15239,0Y9G3ZZ	,1,DRAINAGE OF LEFT KNEE REGION; PERCUTANEOUS APPROACH	,NULL
15240,0Y9G3ZX	,1,DRAINAGE OF LEFT KNEE REGION; PERCUTANEOUS APPROACH; DIAGNOSTIC	,NULL
15295,089K3ZZ	,1,DRAINAGE OF LEFT LENS; PERCUTANEOUS APPROACH	,
15306,0F9200Z	,1,DRAINAGE OF LEFT LOBE LIVER WITH DRAINAGE DEVICE; OPEN APPROACH	,NULL
15307,0F920ZZ	,1,DRAINAGE OF LEFT LOBE LIVER; OPEN APPROACH	,
15308,0F920ZX	,1,DRAINAGE OF LEFT LOBE LIVER; OPEN APPROACH; DIAGNOSTIC	,
15309,0F923ZZ	,1,DRAINAGE OF LEFT LOBE LIVER; PERCUTANEOUS APPROACH	,NULL
15310,0F923ZX	,1,DRAINAGE OF LEFT LOBE LIVER; PERCUTANEOUS APPROACH; DIAGNOSTIC	,NULL
15330,0H9EX0Z	,1,DRAINAGE OF LEFT LOWER ARM SKIN WITH DRAINAGE DEVICE; EXTERNAL APPROACH	,NULL
15331,0H9EXZZ	,1,DRAINAGE OF LEFT LOWER ARM SKIN; EXTERNAL APPROACH	,
15332,0H9EXZX	,1,DRAINAGE OF LEFT LOWER ARM SKIN; EXTERNAL APPROACH; DIAGNOSTIC	,
15335,0J9H0ZZ	,1,DRAINAGE OF LEFT LOWER ARM SUBCUTANEOUS TISSUE AND FASCIA; OPEN APPROACH	,
15336,0J9H0ZX	,1,DRAINAGE OF LEFT LOWER ARM SUBCUTANEOUS TISSUE AND FASCIA; OPEN APPROACH; DIAGNOSTIC	,NULL
15339,0X9F00Z	,1,DRAINAGE OF LEFT LOWER ARM WITH DRAINAGE DEVICE; OPEN APPROACH	,NULL
15340,0X9F30Z	,1,DRAINAGE OF LEFT LOWER ARM WITH DRAINAGE DEVICE; PERCUTANEOUS APPROACH	,NULL
15342,0X9F0ZZ	,1,DRAINAGE OF LEFT LOWER ARM; OPEN APPROACH	,NULL
15368,0Y9B0ZZ	,1,DRAINAGE OF LEFT LOWER EXTREMITY; OPEN APPROACH	,NULL
15379,089R0ZZ	,1,DRAINAGE OF LEFT LOWER EYELID; OPEN APPROACH	,NULL
15401,0H9LX0Z	,1,DRAINAGE OF LEFT LOWER LEG SKIN WITH DRAINAGE DEVICE; EXTERNAL APPROACH	,
15402,0H9LXZZ	,1,DRAINAGE OF LEFT LOWER LEG SKIN; EXTERNAL APPROACH	,NULL
15403,0H9LXZX	,1,DRAINAGE OF LEFT LOWER LEG SKIN; EXTERNAL APPROACH; DIAGNOSTIC	,NULL
15406,0J9P0ZZ	,1,DRAINAGE OF LEFT LOWER LEG SUBCUTANEOUS TISSUE AND FASCIA; OPEN APPROACH	,NULL
15409,0J9P3ZX	,1,DRAINAGE OF LEFT LOWER LEG SUBCUTANEOUS TISSUE AND FASCIA; PERCUTANEOUS APPROACH; DIAGNOSTIC	,
15419,0Y9J00Z	,1,DRAINAGE OF LEFT LOWER LEG WITH DRAINAGE DEVICE; OPEN APPROACH	,NULL
15422,0Y9J0ZZ	,1,DRAINAGE OF LEFT LOWER LEG; OPEN APPROACH	,NULL
15423,0Y9J0ZX	,1,DRAINAGE OF LEFT LOWER LEG; OPEN APPROACH; DIAGNOSTIC	,NULL
15424,0Y9J3ZZ	,1,DRAINAGE OF LEFT LOWER LEG; PERCUTANEOUS APPROACH	,NULL
15435,0B9B3ZZ	,1,DRAINAGE OF LEFT LOWER LOBE BRONCHUS; PERCUTANEOUS APPROACH	,
15441,0B9B8ZX	,1,DRAINAGE OF LEFT LOWER LOBE BRONCHUS; VIA NATURAL OR ARTIFICIAL OPENING ENDOSCOPIC; DIAGNOSTIC	,NULL
15442,0B9B7ZX	,1,DRAINAGE OF LEFT LOWER LOBE BRONCHUS; VIA NATURAL OR ARTIFICIAL OPENING; DIAGNOSTIC	,
15453,0B9J4ZX	,1,DRAINAGE OF LEFT LOWER LUNG LOBE; PERCUTANEOUS ENDOSCOPIC APPROACH; DIAGNOSTIC	,NULL
15456,0B9J8ZX	,1,DRAINAGE OF LEFT LOWER LUNG LOBE; VIA NATURAL OR ARTIFICIAL OPENING ENDOSCOPIC; DIAGNOSTIC	,NULL
15458,0B9L00Z	,1,DRAINAGE OF LEFT LUNG WITH DRAINAGE DEVICE; OPEN APPROACH	,
15459,0B9L30Z	,1,DRAINAGE OF LEFT LUNG WITH DRAINAGE DEVICE; PERCUTANEOUS APPROACH	,NULL
15462,0B9L0ZZ	,1,DRAINAGE OF LEFT LUNG; OPEN APPROACH	,
15463,0B9L0ZX	,1,DRAINAGE OF LEFT LUNG; OPEN APPROACH; DIAGNOSTIC	,
15464,0B9L3ZZ	,1,DRAINAGE OF LEFT LUNG; PERCUTANEOUS APPROACH	,NULL
15465,0B9L3ZX	,1,DRAINAGE OF LEFT LUNG; PERCUTANEOUS APPROACH; DIAGNOSTIC	,NULL
15471,0B9700Z	,1,DRAINAGE OF LEFT MAIN BRONCHUS WITH DRAINAGE DEVICE; OPEN APPROACH	,NULL
15484,0B978ZX	,1,DRAINAGE OF LEFT MAIN BRONCHUS; VIA NATURAL OR ARTIFICIAL OPENING ENDOSCOPIC; DIAGNOSTIC	,NULL
15583,07920ZX	,1,DRAINAGE OF LEFT NECK LYMPHATIC; OPEN APPROACH; DIAGNOSTIC	,NULL
15585,07923ZX	,1,DRAINAGE OF LEFT NECK LYMPHATIC; PERCUTANEOUS APPROACH; DIAGNOSTIC	,NULL
15599,0H9X30Z	,1,DRAINAGE OF LEFT NIPPLE WITH DRAINAGE DEVICE; PERCUTANEOUS APPROACH	,
15606,0H9X3ZZ	,1,DRAINAGE OF LEFT NIPPLE; PERCUTANEOUS APPROACH	,
15627,0N9Q3ZX	,1,DRAINAGE OF LEFT ORBIT; PERCUTANEOUS APPROACH; DIAGNOSTIC	,
15635,0U910ZX	,1,DRAINAGE OF LEFT OVARY; OPEN APPROACH; DIAGNOSTIC	,
15636,0U913ZZ	,1,DRAINAGE OF LEFT OVARY; PERCUTANEOUS APPROACH	,NULL
15638,0U914ZZ	,1,DRAINAGE OF LEFT OVARY; PERCUTANEOUS ENDOSCOPIC APPROACH	,
15667,0C990ZX	,1,DRAINAGE OF LEFT PAROTID GLAND; OPEN APPROACH; DIAGNOSTIC	,NULL
15683,0Q930ZX	,1,DRAINAGE OF LEFT PELVIC BONE; OPEN APPROACH; DIAGNOSTIC	,
15697,0B9P00Z	,1,DRAINAGE OF LEFT PLEURA WITH DRAINAGE DEVICE; OPEN APPROACH	,NULL
15698,0B9P30Z	,1,DRAINAGE OF LEFT PLEURA WITH DRAINAGE DEVICE; PERCUTANEOUS APPROACH	,NULL
15699,0B9P40Z	,1,DRAINAGE OF LEFT PLEURA WITH DRAINAGE DEVICE; PERCUTANEOUS ENDOSCOPIC APPROACH	,
15700,0B9P8ZX,1,"DRAINAGE OF LEFT PLEURA, VIA NATURAL OR ARTIFICIAL",NULL
15702,0B9P0ZX	,1,DRAINAGE OF LEFT PLEURA; OPEN APPROACH; DIAGNOSTIC	,
15703,0B9P3ZZ	,1,DRAINAGE OF LEFT PLEURA; PERCUTANEOUS APPROACH	,NULL
15706,0W9B00Z	,1,DRAINAGE OF LEFT PLEURAL CAVITY WITH DRAINAGE DEVICE; OPEN APPROACH	,NULL
15707,0W9B30Z	,1,DRAINAGE OF LEFT PLEURAL CAVITY WITH DRAINAGE DEVICE; PERCUTANEOUS APPROACH	,NULL
15708,0W9B40Z	,1,DRAINAGE OF LEFT PLEURAL CAVITY WITH DRAINAGE DEVICE; PERCUTANEOUS ENDOSCOPIC APPROACH	,NULL
15709,0W9B0ZZ	,1,DRAINAGE OF LEFT PLEURAL CAVITY; OPEN APPROACH	,NULL
15710,0W9B0ZX	,1,DRAINAGE OF LEFT PLEURAL CAVITY; OPEN APPROACH; DIAGNOSTIC	,
15711,0W9B4ZZ	,1,DRAINAGE OF LEFT PLEURAL CAVITY; PERCUTANEOUS ENDOSCOPIC APPROACH	,NULL
15734,039C0ZZ	,1,DRAINAGE OF LEFT RADIAL ARTERY; OPEN APPROACH	,NULL
15737,039C3ZX	,1,DRAINAGE OF LEFT RADIAL ARTERY; PERCUTANEOUS APPROACH; DIAGNOSTIC	,NULL
15763,069B3ZZ	,1,DRAINAGE OF LEFT RENAL VEIN; PERCUTANEOUS APPROACH	,NULL
15795,0P960ZX	,1,DRAINAGE OF LEFT SCAPULA; OPEN APPROACH; DIAGNOSTIC	,
15827,0R9K3ZX	,1,DRAINAGE OF LEFT SHOULDER JOINT; PERCUTANEOUS APPROACH; DIAGNOSTIC	,
15833,0K960ZZ	,1,DRAINAGE OF LEFT SHOULDER MUSCLE; OPEN APPROACH	,NULL
15836,0K963ZX	,1,DRAINAGE OF LEFT SHOULDER MUSCLE; PERCUTANEOUS APPROACH; DIAGNOSTIC	,NULL
15839,0X9300Z	,1,DRAINAGE OF LEFT SHOULDER REGION WITH DRAINAGE DEVICE; OPEN APPROACH	,NULL
15845,0X933ZX	,1,DRAINAGE OF LEFT SHOULDER REGION; PERCUTANEOUS APPROACH; DIAGNOSTIC	,
15860,0V9G0ZZ	,1,DRAINAGE OF LEFT SPERMATIC CORD; OPEN APPROACH	,
15863,0V9G3ZX	,1,DRAINAGE OF LEFT SPERMATIC CORD; PERCUTANEOUS APPROACH; DIAGNOSTIC	,NULL
15903,059630Z	,1,DRAINAGE OF LEFT SUBCLAVIAN VEIN WITH DRAINAGE DEVICE; PERCUTANEOUS APPROACH	,NULL
15919,0C9H0ZZ	,1,DRAINAGE OF LEFT SUBMAXILLARY GLAND; OPEN APPROACH	,
15976,0V9B00Z	,1,DRAINAGE OF LEFT TESTIS WITH DRAINAGE DEVICE; OPEN APPROACH	,NULL
15979,0V9B0ZZ	,1,DRAINAGE OF LEFT TESTIS; OPEN APPROACH	,NULL
15980,0V9B0ZX	,1,DRAINAGE OF LEFT TESTIS; OPEN APPROACH; DIAGNOSTIC	,
15985,0Y9D0ZX	,1,DRAINAGE OF LEFT THIGH; OPEN; DIAGNOSTIC	,NULL
16035,0G9G0ZX	,1,DRAINAGE OF LEFT THYROID GLAND LOBE; OPEN APPROACH; DIAGNOSTIC	,
16036,0G9G3ZZ	,1,DRAINAGE OF LEFT THYROID GLAND LOBE; PERCUTANEOUS APPROACH	,NULL
16037,0G9G3ZX	,1,DRAINAGE OF LEFT THYROID GLAND LOBE; PERCUTANEOUS APPROACH; DIAGNOSTIC	,NULL
16043,0Q9H0ZZ	,1,DRAINAGE OF LEFT TIBIA; OPEN APPROACH	,
16094,0V9700Z	,1,DRAINAGE OF LEFT TUNICA VAGINALIS WITH DRAINAGE DEVICE; OPEN APPROACH	,NULL
16129,039A0ZZ	,1,DRAINAGE OF LEFT ULNAR ARTERY; OPEN APPROACH	,NULL
16135,0K9800Z	,1,DRAINAGE OF LEFT UPPER ARM MUSCLE WITH DRAINAGE DEVICE; OPEN APPROACH	,NULL
16138,0K980ZZ	,1,DRAINAGE OF LEFT UPPER ARM MUSCLE; OPEN APPROACH	,NULL
16145,0H9CXZZ	,1,DRAINAGE OF LEFT UPPER ARM SKIN; EXTERNAL APPROACH	,NULL
16147,0J9F00Z	,1,DRAINAGE OF LEFT UPPER ARM SUBCUTANEOUS TISSUE AND FASCIA WITH DRAINAGE DEVICE; OPEN APPROACH	,NULL
16149,0J9F0ZZ	,1,DRAINAGE OF LEFT UPPER ARM SUBCUTANEOUS TISSUE AND FASCIA; OPEN APPROACH	,
16150,0J9F0ZX	,1,DRAINAGE OF LEFT UPPER ARM SUBCUTANEOUS TISSUE AND FASCIA; OPEN APPROACH; DIAGNOSTIC	,
16162,0X9900Z	,1,DRAINAGE OF LEFT UPPER ARM WITH DRAINAGE DEVICE; OPEN APPROACH	,NULL
16163,0X9930Z	,1,DRAINAGE OF LEFT UPPER ARM WITH DRAINAGE DEVICE; PERCUTANEOUS APPROACH	,NULL
16165,0X990ZX	,1,DRAINAGE OF LEFT UPPER ARM; OPEN APPROACH; DIAGNOSTIC	,
16167,0X993ZX	,1,DRAINAGE OF LEFT UPPER ARM; PERCUTANEOUS APPROACH; DIAGNOSTIC	,NULL
16182,07940ZZ	,1,DRAINAGE OF LEFT UPPER EXTREMITY LYMPHATIC; OPEN APPROACH	,
16191,0X970ZZ	,1,DRAINAGE OF LEFT UPPER EXTREMITY; OPEN APPROACH	,NULL
16198,089P00Z	,1,DRAINAGE OF LEFT UPPER EYELID WITH DRAINAGE DEVICE; OPEN APPROACH	,NULL
16225,0H9JXZZ	,1,DRAINAGE OF LEFT UPPER LEG SKIN; EXTERNAL APPROACH	,NULL
16226,0H9JXZX	,1,DRAINAGE OF LEFT UPPER LEG SKIN; EXTERNAL APPROACH; DIAGNOSTIC	,NULL
16227,0J9M00Z	,1,DRAINAGE OF LEFT UPPER LEG SUBCUTANEOUS TISSUE AND FASCIA WITH DRAINAGE DEVICE; OPEN APPROACH	,NULL
16229,0J9M0ZZ	,1,DRAINAGE OF LEFT UPPER LEG SUBCUTANEOUS TISSUE AND FASCIA; OPEN APPROACH	,
16230,0J9M0ZX	,1,DRAINAGE OF LEFT UPPER LEG SUBCUTANEOUS TISSUE AND FASCIA; OPEN APPROACH; DIAGNOSTIC	,
16231,0J9M3ZZ	,1,DRAINAGE OF LEFT UPPER LEG SUBCUTANEOUS TISSUE AND FASCIA; PERCUTANEOUS APPROACH	,NULL
16242,0Y9D00Z	,1,DRAINAGE OF LEFT UPPER LEG WITH DRAINAGE DEVICE; OPEN APPROACH	,NULL
16243,0Y9D30Z	,1,DRAINAGE OF LEFT UPPER LEG WITH DRAINAGE DEVICE; PERCUTANEOUS APPROACH	,NULL
16245,0Y9D0ZZ	,1,DRAINAGE OF LEFT UPPER LEG; OPEN APPROACH	,NULL
16246,0Y9D3ZZ	,1,DRAINAGE OF LEFT UPPER LEG; PERCUTANEOUS APPROACH	,NULL
16247,0Y9D3ZX	,1,DRAINAGE OF LEFT UPPER LEG; PERCUTANEOUS APPROACH; DIAGNOSTIC	,
16251,0B9830Z	,1,DRAINAGE OF LEFT UPPER LOBE BRONCHUS WITH DRAINAGE DEVICE; PERCUTANEOUS APPROACH	,
16263,0B988ZX	,1,DRAINAGE OF LEFT UPPER LOBE BRONCHUS; VIA NATURAL OR ARTIFICIAL OPENING ENDOSCOPIC; DIAGNOSTIC	,
16266,0B9G30Z	,1,DRAINAGE OF LEFT UPPER LUNG LOBE WITH DRAINAGE DEVICE; PERCUTANEOUS APPROACH	,NULL
16275,0B9G4ZX	,1,DRAINAGE OF LEFT UPPER LUNG LOBE; PERCUTANEOUS ENDOSCOPIC APPROACH; DIAGNOSTIC	,
16278,0B9G8ZX	,1,DRAINAGE OF LEFT UPPER LUNG LOBE; VIA NATURAL OR ARTIFICIAL OPENING ENDOSCOPIC; DIAGNOSTIC	,NULL
16280,0T9700Z	,1,DRAINAGE OF LEFT URETER WITH DRAINAGE DEVICE; OPEN APPROACH	,NULL
16281,0T9730Z	,1,DRAINAGE OF LEFT URETER WITH DRAINAGE DEVICE; PERCUTANEOUS APPROACH	,NULL
16282,0T9740Z	,1,DRAINAGE OF LEFT URETER WITH DRAINAGE DEVICE; PERCUTANEOUS ENDOSCOPIC APPROACH	,NULL
16283,0T9770Z	,1,DRAINAGE OF LEFT URETER WITH DRAINAGE DEVICE; VIA NATURAL OR ARTIFICIAL OPENING	,NULL
16284,0T9780Z	,1,DRAINAGE OF LEFT URETER WITH DRAINAGE DEVICE; VIA NATURAL OR ARTIFICIAL OPENING ENDOSCOPIC	,NULL
16286,0T970ZX	,1,DRAINAGE OF LEFT URETER; OPEN APPROACH; DIAGNOSTIC	,
16292,0T978ZZ	,1,DRAINAGE OF LEFT URETER; VIA NATURAL OR ARTIFICIAL OPENING ENDOSCOPIC	,NULL
16293,0T978ZX	,1,DRAINAGE OF LEFT URETER; VIA NATURAL OR ARTIFICIAL OPENING ENDOSCOPIC; DIAGNOSTIC	,
16299,0V9P0ZX	,1,DRAINAGE OF LEFT VAS DEFERENS; OPEN APPROACH; DIAGNOSTIC	,
16322,089530Z	,1,DRAINAGE OF LEFT VITREOUS WITH DRAINAGE DEVICE; PERCUTANEOUS APPROACH	,
16323,08953ZZ	,1,DRAINAGE OF LEFT VITREOUS; PERCUTANEOUS APPROACH	,
16324,08953ZX	,1,DRAINAGE OF LEFT VITREOUS; PERCUTANEOUS APPROACH; DIAGNOSTIC	,
16361,0X9H0ZZ	,1,DRAINAGE OF LEFT WRIST REGION; OPEN APPROACH	,NULL
16394,0B994ZZ	,1,DRAINAGE OF LINGULA BRONCHUS; PERCUTANEOUS ENDOSCOPIC APPROACH	,NULL
16401,0F9040Z	,1,DRAINAGE OF LIVER WITH DRAINAGE DEVICE; PERCUTANEOUS ENDOSCOPIC APPROACH	,NULL
16402,0F900ZZ	,1,DRAINAGE OF LIVER; OPEN APPROACH	,
16403,0F900ZX	,1,DRAINAGE OF LIVER; OPEN APPROACH; DIAGNOSTIC	,
16404,0F903ZZ	,1,DRAINAGE OF LIVER; PERCUTANEOUS APPROACH	,NULL
16405,0F903ZX	,1,DRAINAGE OF LIVER; PERCUTANEOUS APPROACH; DIAGNOSTIC	,NULL
16406,0F904ZX	,1,DRAINAGE OF LIVER; PERCUTANEOUS ENDOSCOPIC APPROACH; DIAGNOSTIC	,NULL
16416,0W9L00Z	,1,DRAINAGE OF LOWER BACK WITH DRAINAGE DEVICE; OPEN APPROACH	,NULL
16417,0W9L30Z	,1,DRAINAGE OF LOWER BACK WITH DRAINAGE DEVICE; PERCUTANEOUS APPROACH	,NULL
16418,0W9L40Z	,1,DRAINAGE OF LOWER BACK WITH DRAINAGE DEVICE; PERCUTANEOUS ENDOSCOPIC APPROACH	,NULL
16419,0W9L0ZZ	,1,DRAINAGE OF LOWER BACK; OPEN APPROACH	,NULL
16420,0W9L0ZX	,1,DRAINAGE OF LOWER BACK; OPEN APPROACH; DIAGNOSTIC	,
16421,0W9L3ZZ	,1,DRAINAGE OF LOWER BACK; PERCUTANEOUS APPROACH	,NULL
16422,0W9L3ZX	,1,DRAINAGE OF LOWER BACK; PERCUTANEOUS APPROACH; DIAGNOSTIC	,NULL
16454,0W953ZZ	,1,DRAINAGE OF LOWER JAW; PERCUTANEOUS APPROACH	,NULL
16461,0C91XZZ	,1,DRAINAGE OF LOWER LIP; EXTERNAL APPROACH	,
16465,0C913ZZ	,1,DRAINAGE OF LOWER LIP; PERCUTANEOUS APPROACH	,NULL
16475,0C9XXZ0	,1,DRAINAGE OF LOWER TOOTH; EXTERNAL APPROACH; SINGLE	,
16482,069Y0ZZ	,1,DRAINAGE OF LOWER VEIN; OPEN APPROACH	,NULL
16507,009Y30Z	,1,DRAINAGE OF LUMBAR SPINAL CORD WITH DRAINAGE DEVICE; PERCUTANEOUS APPROACH	,NULL
16509,009Y0ZZ	,1,DRAINAGE OF LUMBAR SPINAL CORD; OPEN APPROACH	,NULL
16511,009Y3ZZ	,1,DRAINAGE OF LUMBAR SPINAL CORD; PERCUTANEOUS APPROACH	,NULL
16512,009Y3ZX	,1,DRAINAGE OF LUMBAR SPINAL CORD; PERCUTANEOUS APPROACH; DIAGNOSTIC	,NULL
16529,0Q903ZZ	,1,DRAINAGE OF LUMBAR VERTEBRA; PERCUTANEOUS APPROACH	,
16591,0B9H8ZX	,1,DRAINAGE OF LUNG LINGULA; VIA NATURAL OR ARTIFICIAL OPENING ENDOSCOPIC; DIAGNOSTIC	,NULL
16592,0B9H7ZX	,1,DRAINAGE OF LUNG LINGULA; VIA NATURAL OR ARTIFICIAL OPENING; DIAGNOSTIC	,
16593,0W9M00Z	,1,DRAINAGE OF MALE PERINEUM WITH DRAINAGE DEVICE; OPEN APPROACH	,NULL
16594,0W9M30Z	,1,DRAINAGE OF MALE PERINEUM WITH DRAINAGE DEVICE; PERCUTANEOUS APPROACH	,NULL
16596,0W9M0ZZ	,1,DRAINAGE OF MALE PERINEUM; OPEN APPROACH	,NULL
16597,0W9M0ZX	,1,DRAINAGE OF MALE PERINEUM; OPEN APPROACH; DIAGNOSTIC	,
16598,0W9M3ZZ	,1,DRAINAGE OF MALE PERINEUM; PERCUTANEOUS APPROACH	,NULL
16599,0W9M3ZX	,1,DRAINAGE OF MALE PERINEUM; PERCUTANEOUS APPROACH; DIAGNOSTIC	,
16611,0W9C00Z	,1,DRAINAGE OF MEDIASTINUM WITH DRAINAGE DEVICE; OPEN APPROACH	,
16617,0W9C3ZX	,1,DRAINAGE OF MEDIASTINUM; PERCUTANEOUS APPROACH; DIAGNOSTIC	,NULL
16632,079B0ZZ	,1,DRAINAGE OF MESENTERIC LYMPHATIC; OPEN APPROACH	,
16642,0D9V0ZX	,1,DRAINAGE OF MESENTERY; OPEN APPROACH; DIAGNOSTIC	,NULL
16643,0D9V3ZZ	,1,DRAINAGE OF MESENTERY; PERCUTANEOUS APPROACH	,NULL
16644,0D9V3ZX	,1,DRAINAGE OF MESENTERY; PERCUTANEOUS APPROACH; DIAGNOSTIC	,
16695,099M00Z	,1,DRAINAGE OF NASAL SEPTUM WITH DRAINAGE DEVICE; OPEN APPROACH	,NULL
16698,099M0ZZ	,1,DRAINAGE OF NASAL SEPTUM; OPEN APPROACH	,NULL
16734,0H94X0Z	,1,DRAINAGE OF NECK ;EXTERNAL APPROACH	,NULL
16735,0W9600Z	,1,DRAINAGE OF NECK CARBUNCLE (OPEN),NULL
16736,0H94XZZ	,1,DRAINAGE OF NECK SKIN; EXTERNAL APPROACH	,NULL
16737,0H94XZX	,1,DRAINAGE OF NECK SKIN; EXTERNAL APPROACH; DIAGNOSTIC	,NULL
16738,0W9630Z	,1,DRAINAGE OF NECK WITH DRAINAGE DEVICE; PERCUTANEOUS APPROACH	,NULL
16740,0W960ZZ	,1,DRAINAGE OF NECK; OPEN APPROACH	,NULL
16741,0W960ZX	,1,DRAINAGE OF NECK; OPEN APPROACH; DIAGNOSTIC	,NULL
16752,099K0ZZ	,1,DRAINAGE OF NOSE; OPEN APPROACH	,
16755,099K3ZX	,1,DRAINAGE OF NOSE; PERCUTANEOUS APPROACH; DIAGNOSTIC	,
16808,10900ZD	,1,DRAINAGE OF OTHER FLUID FROM PRODUCTS OF CONCEPTION; OPEN APPROACH	,NULL
16813,0F9G80Z,1,DRAINAGE OF PANCREAS WITH DRAINAGE DEVICE,NULL
16814,0F9G00Z	,1,DRAINAGE OF PANCREAS WITH DRAINAGE DEVICE; OPEN APPROACH	,
16815,0F9G30Z	,1,DRAINAGE OF PANCREAS WITH DRAINAGE DEVICE; PERCUTANEOUS APPROACH	,NULL
16816,0F9G8ZZ,1,DRAINAGE OF PANCREAS WITH NO DEVICE; VIA NATURAL O,NULL
16817,0F9G0ZZ	,1,DRAINAGE OF PANCREAS; OPEN APPROACH	,NULL
16818,0F9G0ZX	,1,DRAINAGE OF PANCREAS; OPEN APPROACH; DIAGNOSTIC	,
16819,0F9G3ZZ	,1,DRAINAGE OF PANCREAS; PERCUTANEOUS APPROACH	,NULL
16820,0F9G3ZX	,1,DRAINAGE OF PANCREAS; PERCUTANEOUS APPROACH; DIAGNOSTIC	,NULL
16821,0F9G4ZZ	,1,DRAINAGE OF PANCREAS; PERCUTANEOUS ENDOSCOPIC APPROACH	,NULL
16822,0F9G4ZX	,1,DRAINAGE OF PANCREAS; PERCUTANEOUS ENDOSCOPIC APPROACH; DIAGNOSTIC	,
16824,0F9D30Z	,1,DRAINAGE OF PANCREATIC DUCT WITH DRAINAGE DEVICE; PERCUTANEOUS APPROACH	,NULL
16827,0F9D80Z	,1,DRAINAGE OF PANCREATIC DUCT WITH DRAINAGE DEVICE; VIA NATURAL OR ARTIFICIAL OPENING ENDOSCOPIC	,NULL
16831,0F9D3ZX	,1,DRAINAGE OF PANCREATIC DUCT; PERCUTANEOUS APPROACH; DIAGNOSTIC	,
16833,0F9D4ZX	,1,DRAINAGE OF PANCREATIC DUCT; PERCUTANEOUS ENDOSCOPIC APPROACH; DIAGNOSTIC	,NULL
16835,0F9D8ZZ	,1,DRAINAGE OF PANCREATIC DUCT; VIA NATURAL OR ARTIFICIAL OPENING ENDOSCOPIC	,
16836,0F9D8ZX	,1,DRAINAGE OF PANCREATIC DUCT; VIA NATURAL OR ARTIFICIAL OPENING ENDOSCOPIC; DIAGNOSTIC	,
16865,0W9J40Z	,1,DRAINAGE OF PELVIC ABSCESS (PERCUTANEOUS),NULL
16866,0W9J00Z	,1,DRAINAGE OF PELVIC CAVITY WITH DRAINAGE DEVICE; OPEN APPROACH	,NULL
16867,0W9J30Z	,1,DRAINAGE OF PELVIC CAVITY WITH DRAINAGE DEVICE; PERCUTANEOUS APPROACH	,NULL
16868,0W9J0ZZ	,1,DRAINAGE OF PELVIC CAVITY; OPEN APPROACH	,
16870,0W9J3ZZ	,1,DRAINAGE OF PELVIC CAVITY; PERCUTANEOUS APPROACH	,NULL
16871,0W9J3ZX	,1,DRAINAGE OF PELVIC CAVITY; PERCUTANEOUS APPROACH; DIAGNOSTIC	,NULL
16872,0W9J4ZZ	,1,DRAINAGE OF PELVIC CAVITY; PERCUTANEOUS ENDOSCOPIC APPROACH	,NULL
16878,0J9C3ZZ	,1,DRAINAGE OF PELVIC REGION SUBCUTANEOUS TISSUE AND FASCIA; PERCUTANEOUS APPROACH	,
16880,079C00Z	,1,DRAINAGE OF PELVIS LYMPHATIC WITH DRAINAGE DEVICE; OPEN APPROACH	,NULL
16885,079C3ZX	,1,DRAINAGE OF PELVIS LYMPHATIC; PERCUTANEOUS APPROACH; DIAGNOSTIC	,NULL
16887,079C4ZX	,1,DRAINAGE OF PELVIS LYMPHATIC; PERCUTANEOUS ENDOSCOPIC APPROACH; DIAGNOSTIC	,NULL
16888,0V9SX0Z	,1,DRAINAGE OF PENIS WITH DRAINAGE DEVICE; EXTERNAL APPROACH	,NULL
16889,0V9S00Z	,1,DRAINAGE OF PENIS WITH DRAINAGE DEVICE; OPEN APPROACH	,NULL
16890,0V9S30Z	,1,DRAINAGE OF PENIS WITH DRAINAGE DEVICE; PERCUTANEOUS APPROACH	,NULL
16892,0V9SXZZ	,1,DRAINAGE OF PENIS; EXTERNAL APPROACH	,NULL
16894,0V9S0ZZ	,1,DRAINAGE OF PENIS; OPEN APPROACH	,NULL
16895,0V9S0ZX	,1,DRAINAGE OF PENIS; OPEN APPROACH; DIAGNOSTIC	,
16896,0V9S3ZZ	,1,DRAINAGE OF PENIS; PERCUTANEOUS APPROACH	,NULL
16897,0V9S3ZX	,1,DRAINAGE OF PENIS; PERCUTANEOUS APPROACH; DIAGNOSTIC	,
16900,0D9QXZZ	,1,DRAINAGE OF PERIANAL ABSCESS,NULL
16901,0D9Q30Z	,1,DRAINAGE OF PERIANAL ABSCESS PERCUTANEOUS APPROACH,NULL
16902,0W9D00Z	,1,DRAINAGE OF PERICARDIAL CAVITY WITH DRAINAGE DEVICE; OPEN APPROACH	,NULL
16903,0W9D30Z	,1,DRAINAGE OF PERICARDIAL CAVITY WITH DRAINAGE DEVICE; PERCUTANEOUS APPROACH	,NULL
16904,0W9D0ZZ	,1,DRAINAGE OF PERICARDIAL CAVITY; OPEN APPROACH	,NULL
16905,0W9D0ZX	,1,DRAINAGE OF PERICARDIAL CAVITY; OPEN APPROACH; DIAGNOSTIC	,NULL
16906,0W9D3ZZ	,1,DRAINAGE OF PERICARDIAL CAVITY; PERCUTANEOUS APPROACH	,NULL
16907,0W9D3ZX	,1,DRAINAGE OF PERICARDIAL CAVITY; PERCUTANEOUS APPROACH; DIAGNOSTIC	,NULL
16908,0W9D4ZZ	,1,DRAINAGE OF PERICARDIAL CAVITY; PERCUTANEOUS ENDOSCOPIC APPROACH	,
16909,0W9D4ZX	,1,DRAINAGE OF PERICARDIAL CAVITY; PERCUTANEOUS ENDOSCOPIC APPROACH; DIAGNOSTIC	,
16910,0W9H30Z	,1,DRAINAGE OF PERIGRAFT COLLECTION,NULL
16923,0K9M0ZZ	,1,DRAINAGE OF PERINEUM MUSCLE; OPEN APPROACH	,NULL
16929,0H99X0Z	,1,DRAINAGE OF PERINEUM SKIN WITH DRAINAGE DEVICE; EXTERNAL APPROACH	,NULL
16930,0H99XZZ	,1,DRAINAGE OF PERINEUM SKIN; EXTERNAL APPROACH	,NULL
16931,0H99XZX	,1,DRAINAGE OF PERINEUM SKIN; EXTERNAL APPROACH; DIAGNOSTIC	,
16934,0J9B0ZZ	,1,DRAINAGE OF PERINEUM SUBCUTANEOUS TISSUE AND FASCIA; OPEN APPROACH	,
16937,0J9B3ZX	,1,DRAINAGE OF PERINEUM SUBCUTANEOUS TISSUE AND FASCIA; PERCUTANEOUS APPROACH; DIAGNOSTIC	,
16947,0W9G00Z	,1,DRAINAGE OF PERITONEAL CAVITY WITH DRAINAGE DEVICE; OPEN APPROACH	,NULL
16948,0W9G30Z	,1,DRAINAGE OF PERITONEAL CAVITY WITH DRAINAGE DEVICE; PERCUTANEOUS APPROACH	,NULL
16949,0W9G40Z	,1,DRAINAGE OF PERITONEAL CAVITY WITH DRAINAGE DEVICE; PERCUTANEOUS ENDOSCOPIC APPROACH	,NULL
16950,0W9G0ZZ	,1,DRAINAGE OF PERITONEAL CAVITY; OPEN APPROACH	,NULL
16951,0W9G0ZX	,1,DRAINAGE OF PERITONEAL CAVITY; OPEN APPROACH; DIAGNOSTIC	,NULL
16952,0W9G3ZZ	,1,DRAINAGE OF PERITONEAL CAVITY; PERCUTANEOUS APPROACH	,NULL
16953,0W9G3ZX	,1,DRAINAGE OF PERITONEAL CAVITY; PERCUTANEOUS APPROACH; DIAGNOSTIC	,NULL
