ProcedureURN,ProcedureID,Active,Procedures,Description
1,06BG0ZX	,1,BIOPSY OF LT EXTERNAL ILIAC VEIN; OPEN;DIAGNOSTIC,
2,03L23ZZ	,1,BRACHIOCEPHALIC FISTULA LIGATION,
3,0HB5XZX	,1,CHEST SKIN BIOPSY;EXTERNAL APPROACH; DIAGNOSTIC	,NULL
4,0TCB0ZZ	,1,EXTIR OF SOLID MATERIALFROMBLADDER(CYSTOLITHOTOMY,NULL
5,0WJG0ZZ	,1,LAPAROTOMY,NULL
6,0HBNXZX	,1,LEFT FOOT SKIN BIOPSY; DIAGNOSTIC	,NULL
7,0TB70ZX	,1,LEFT URETER BIOPSY ; OPEN ; DIAGNOSTIC	,NULL
8,09BK4ZZ	,1,NASAL-POLYPECTOMY+FESS,
9,0TP940Z	,1,PERCUTANEOUS DJ REMOVAL	,NULL
10,3E1M39Z	,1,PERITONEAL DIALYSIS,NULL
11,0GT30ZZ,1,RIGHT ADRENALECTOMY,NULL
12,0B110F4	,1,TRACHEOSTOMY 	,NULL
18,10A07Z6	,1,ABORTION OF PRODUCTS OF CONCEPTION; VACUUM; VIA NATURAL OR ARTIFICIAL OPENING	,NULL
19,10A07ZZ	,1,ABORTION OF PRODUCTS OF CONCEPTION; VIA NATURAL OR ARTIFICIAL OPENING	,
675,0Y6R0Z0	,1,AMPUTATION OF RIGHT 2ND TOE; COMPLETE	,NULL
676,0Y6T0Z0	,1,AMPUTATION OF RIGHT 3RD TOE; COMPLETE	,NULL
677,0Y6P0Z0	,1,AMPUTATION OF RIGHT BIG TOE	 	,NULL
678,0D1A0ZB	,1,ANASTOMOSIS JEJUNUM TO ILEUM; OPEN APPROACH	,NULL
679,05HM3DZ	,1,ANGIOACCESS; INTERNAL JUGULAR RIGHT VEIN,NULL
680,05H53DZ	,1,ANGIOACCESS; SUBCLAVIAN RIGHT VEIN,NULL
681,06HN3DZ	,1,ANGIOACCESS; FEMORAL LINE LEFT VEIN,NULL
682,06HM3DZ	,1,ANGIOACCESS; FEMORAL LINE RIGHT VEIN,NULL
683,05HN3DZ	,1,ANGIOACCESS; INTERNAL JUGULAR LEFT VEIN,NULL
684,05H63DZ	,1,ANGIOACCESS; SUBCLAVIAN LEFT VEIN,NULL
687,0T764DZ	,1,ANTIGARDE DJ PLACEMENT,NULL
698,0DTJ4ZZ	,1,APPENDECTOMY (PERCUTANEOUS ENDOSCOPIC),NULL
699,0DTJ0ZZ	,1,APPENDECTOMY ; OPEN,NULL
711,0D9680Z	,1,ASCITIC TAP (PARACENTESIS),NULL
712,079T3ZX	,1,ASPIRATION OF BONE MARROW / LUMBER PUNCTURE,NULL
713,0F9G40Z	,1,ASPIRATION OF PSEUDOCYCT OF PANCREAS,NULL
714,5A02210	,1,ASSISTANCE WITH CARDIAC OUTPUT USING BALLOON PUMP; CONTINUOUS	,NULL
715,5A02110	,1,ASSISTANCE WITH CARDIAC OUTPUT USING BALLOON PUMP; INTERMITTENT	,NULL
718,5A02216	,1,ASSISTANCE WITH CARDIAC OUTPUT USING OTHER PUMP; CONTINUOUS	,NULL
722,5A0945Z	,1,ASSISTANCE WITH RESPIRATORY VENTILATION; 24-96 CONSECUTIVE HOURS	,NULL
724,5A09457	,1,ASSISTANCE WITH RESPIRATORY VENTILATION; 24-96 CONSECUTIVE HOURS; CONTINUOUS POSITIVE AIRWAY PRESSURE	,NULL
727,5A0955Z	,1,ASSISTANCE WITH RESPIRATORY VENTILATION; GREATER THAN 96 CONSECUTIVE HOURS	,NULL
729,5A09557	,1,ASSISTANCE WITH RESPIRATORY VENTILATION; GREATER THAN 96 CONSECUTIVE HOURS; CONTINUOUS POSITIVE AIRWAY PRESSURE	,NULL
731,5A09558	,1,ASSISTANCE WITH RESPIRATORY VENTILATION; GREATER THAN 96 CONSECUTIVE HOURS; INTERMITTENT POSITIVE AIRWAY PRESSURE	,NULL
732,5A0935Z	,1,ASSISTANCE WITH RESPIRATORY VENTILATION; LESS THAN 24 CONSECUTIVE HOURS	,NULL
733,5A09359	,1,ASSISTANCE WITH RESPIRATORY VENTILATION; LESS THAN 24 CONSECUTIVE HOURS; CONTINUOUS NEGATIVE AIRWAY PRESSURE	,NULL
734,5A09357	,1,ASSISTANCE WITH RESPIRATORY VENTILATION; LESS THAN 24 CONSECUTIVE HOURS; CONTINUOUS POSITIVE AIRWAY PRESSURE	,NULL
736,5A09358	,1,ASSISTANCE WITH RESPIRATORY VENTILATION; LESS THAN 24 CONSECUTIVE HOURS; INTERMITTENT POSITIVE AIRWAY PRESSURE	,NULL
767,0TUB07Z	,1,AUGMENTATION CYSTOPLASTY/MONTI PROCEDURE,NULL
791,0BBM0ZX	,1,"B/L LUNG BIOPSY,OPEN APPROACH	",NULL
823,DW032ZZ	,1,BEAM RADIATION OF ABDOMEN USING PHOTONS >10 MEV	,NULL
824,DW031ZZ	,1,BEAM RADIATION OF ABDOMEN USING PHOTONS 1 - 10 MEV	,NULL
832,DH043ZZ	,1,BEAM RADIATION OF ARM SKIN USING ELECTRONS	,NULL
839,DH041ZZ	,1,BEAM RADIATION OF ARM SKIN USING PHOTONS 1 - 10 MEV	,NULL
846,D7042ZZ	,1,BEAM RADIATION OF AXILLARY LYMPHATICS USING PHOTONS >10 MEV	,NULL
864,DT023ZZ	,1,BEAM RADIATION OF BLADDER USING ELECTRONS	,NULL
865,DT023Z0	,1,BEAM RADIATION OF BLADDER USING ELECTRONS; INTRAOPERATIVE	,NULL
866,DT024ZZ	,1,BEAM RADIATION OF BLADDER USING HEAVY PARTICLES (PROTONS;IONS)	,NULL
867,DT026ZZ	,1,BEAM RADIATION OF BLADDER USING NEUTRON CAPTURE	,NULL
868,DT025ZZ	,1,BEAM RADIATION OF BLADDER USING NEUTRONS	,NULL
869,DT020ZZ	,1,BEAM RADIATION OF BLADDER USING PHOTONS <1 MEV	,NULL
870,DT022ZZ	,1,BEAM RADIATION OF BLADDER USING PHOTONS >10 MEV	,NULL
871,DT021ZZ	,1,BEAM RADIATION OF BLADDER USING PHOTONS 1 - 10 MEV	,NULL
894,D0002ZZ	,1,BEAM RADIATION OF BRAIN USING PHOTONS >10 MEV	,NULL
895,D0001ZZ	,1,BEAM RADIATION OF BRAIN USING PHOTONS 1 - 10 MEV	,NULL
918,DU012ZZ	,1,BEAM RADIATION OF CERVIX USING PHOTONS >10 MEV	,NULL
919,DU011ZZ	,1,BEAM RADIATION OF CERVIX USING PHOTONS 1 - 10 MEV	,NULL
926,DH062ZZ	,1,BEAM RADIATION OF CHEST SKIN USING PHOTONS >10 MEV	,NULL
934,DW022ZZ	,1,BEAM RADIATION OF CHEST USING PHOTONS >10 MEV	,NULL
935,DW021ZZ	,1,BEAM RADIATION OF CHEST USING PHOTONS 1 - 10 MEV	,NULL
942,DB072ZZ	,1,BEAM RADIATION OF CHEST WALL USING PHOTONS >10 MEV	,NULL
982,DD002ZZ	,1,BEAM RADIATION OF ESOPHAGUS USING PHOTONS >10 MEV	,NULL
983,DD001ZZ	,1,BEAM RADIATION OF ESOPHAGUS USING PHOTONS 1 - 10 MEV	,
998,DH022ZZ	,1,BEAM RADIATION OF FACE SKIN USING PHOTONS >10 MEV	,NULL
999,DH021ZZ	,1,BEAM RADIATION OF FACE SKIN USING PHOTONS 1 - 10 MEV	,NULL
1006,DP092ZZ	,1,BEAM RADIATION OF FEMUR USING PHOTONS >10 MEV	,NULL
1007,DP091ZZ	,1,BEAM RADIATION OF FEMUR USING PHOTONS 1 - 10 MEV	,NULL
1030,DW012ZZ	,1,BEAM RADIATION OF HEAD AND NECK USING PHOTONS >10 MEV	,NULL
1031,DW011ZZ	,1,BEAM RADIATION OF HEAD AND NECK USING PHOTONS 1 - 10 MEV	,NULL
1038,DW042ZZ	,1,BEAM RADIATION OF HEMIBODY USING PHOTONS >10 MEV	,NULL
1040,DP063ZZ	,1,BEAM RADIATION OF HUMERUS USING ELECTRONS	,NULL
1046,DP062ZZ	,1,BEAM RADIATION OF HUMERUS USING PHOTONS >10 MEV	,NULL
1047,DP061ZZ	,1,BEAM RADIATION OF HUMERUS USING PHOTONS 1 - 10 MEV	,NULL
1080,DT003ZZ	,1,BEAM RADIATION OF KIDNEY USING ELECTRONS	,NULL
1081,DT003Z0	,1,BEAM RADIATION OF KIDNEY USING ELECTRONS; INTRAOPERATIVE	,NULL
1082,DT004ZZ	,1,BEAM RADIATION OF KIDNEY USING HEAVY PARTICLES (PROTONS;IONS)	,NULL
1083,DT006ZZ	,1,BEAM RADIATION OF KIDNEY USING NEUTRON CAPTURE	,NULL
1084,DT005ZZ	,1,BEAM RADIATION OF KIDNEY USING NEUTRONS	,NULL
1085,DT000ZZ	,1,BEAM RADIATION OF KIDNEY USING PHOTONS <1 MEV	,NULL
1086,DT002ZZ	,1,BEAM RADIATION OF KIDNEY USING PHOTONS >10 MEV	,NULL
1087,DT001ZZ	,1,BEAM RADIATION OF KIDNEY USING PHOTONS 1 - 10 MEV	,NULL
1095,D90B1ZZ	,1,BEAM RADIATION OF LARYNX USING PHOTONS 1 - 10 MEV	,NULL
1096,DM003ZZ	,1,BEAM RADIATION OF LEFT BREAST USING ELECTRONS	,NULL
1102,DM002ZZ	,1,BEAM RADIATION OF LEFT BREAST USING PHOTONS >10 MEV	,NULL
1103,DM001ZZ	,1,BEAM RADIATION OF LEFT BREAST USING PHOTONS 1 - 10 MEV	,NULL
1126,DB022ZZ	,1,BEAM RADIATION OF LUNG USING PHOTONS >10 MEV	,NULL
1158,D9042ZZ	,1,BEAM RADIATION OF MOUTH USING PHOTONS >10 MEV	,NULL
1159,D9041ZZ	,1,BEAM RADIATION OF MOUTH USING PHOTONS 1 - 10 MEV	,NULL
1182,DH032ZZ	,1,BEAM RADIATION OF NECK SKIN USING PHOTONS >10 MEV	,NULL
1190,D9012ZZ	,1,BEAM RADIATION OF NOSE USING PHOTONS >10 MEV	,NULL
1205,DP0C0ZZ	,1,BEAM RADIATION OF OTHER BONE USING PHOTONS <1 MEV	,NULL
1206,DP0C2ZZ	,1,BEAM RADIATION OF OTHER BONE USING PHOTONS >10 MEV	,NULL
1207,DP0C1ZZ	,1,BEAM RADIATION OF OTHER BONE USING PHOTONS 1 - 10 MEV	,NULL
1214,DU002ZZ	,1,BEAM RADIATION OF OVARY USING PHOTONS &GT;10 MEV	,
1231,DP083ZZ	,1,BEAM RADIATION OF PELVIC BONES USING ELECTRONS	,NULL
1237,DP082ZZ	,1,BEAM RADIATION OF PELVIC BONES USING PHOTONS >10 MEV	,NULL
1238,DP081ZZ	,1,BEAM RADIATION OF PELVIC BONES USING PHOTONS 1 - 10 MEV	,NULL
1245,DW062ZZ	,1,BEAM RADIATION OF PELVIC REGION USING PHOTONS >10 MEV	,NULL
1246,DW061ZZ	,1,BEAM RADIATION OF PELVIC REGION USING PHOTONS 1 - 10 MEV	,NULL
1261,D0072ZZ	,1,BEAM RADIATION OF PERIPHERAL NERVE USING PHOTONS >10 MEV	,NULL
1292,DV002ZZ	,1,BEAM RADIATION OF PROSTATE USING PHOTONS >10 MEV	,NULL
1293,DV001ZZ	,1,BEAM RADIATION OF PROSTATE USING PHOTONS 1 - 10 MEV	,NULL
1301,DP071ZZ	,1,BEAM RADIATION OF RADIUS/ULNA USING PHOTONS 1 - 10 MEV	,
1308,DD072ZZ	,1,BEAM RADIATION OF RECTUM USING PHOTONS >10 MEV	,NULL
1309,DD071ZZ	,1,BEAM RADIATION OF RECTUM USING PHOTONS 1 - 10 MEV	,NULL
1310,DP053ZZ	,1,BEAM RADIATION OF RIB(S) USING ELECTRONS	,NULL
1317,DP051ZZ	,1,BEAM RADIATION OF RIB(S) USING PHOTONS 1 - 10 MEV	,NULL
1318,DM013ZZ	,1,BEAM RADIATION OF RIGHT BREAST USING ELECTRONS	,NULL
1324,DM012ZZ	,1,BEAM RADIATION OF RIGHT BREAST USING PHOTONS >10 MEV	,NULL
1325,DM011ZZ	,1,BEAM RADIATION OF RIGHT BREAST USING PHOTONS 1 - 10 MEV	,NULL
1348,DP002ZZ	,1,BEAM RADIATION OF SKULL USING PHOTONS >10 MEV	,NULL
1364,D0062ZZ	,1,BEAM RADIATION OF SPINAL CORD USING PHOTONS >10 MEV	,NULL
1365,D0061ZZ	,1,BEAM RADIATION OF SPINAL CORD USING PHOTONS 1 - 10 MEV	,NULL
1374,DP043ZZ	,1,BEAM RADIATION OF STERNUM USING ELECTRONS	,NULL
1388,DD012ZZ	,1,BEAM RADIATION OF STOMACH USING PHOTONS >10 MEV	,NULL
1404,D7052ZZ	,1,BEAM RADIATION OF THORAX LYMPHATICS USING PHOTONS >10 MEV	,NULL
1435,D9052ZZ	,1,BEAM RADIATION OF TONGUE USING PHOTONS >10 MEV	,NULL
1445,DT013ZZ	,1,BEAM RADIATION OF URETER USING ELECTRONS	,NULL
1446,DT013Z0	,1,BEAM RADIATION OF URETER USING ELECTRONS; INTRAOPERATIVE	,NULL
1447,DT014ZZ	,1,BEAM RADIATION OF URETER USING HEAVY PARTICLES (PROTONS;IONS)	,NULL
1448,DT016ZZ	,1,BEAM RADIATION OF URETER USING NEUTRON CAPTURE	,NULL
1449,DT015ZZ	,1,BEAM RADIATION OF URETER USING NEUTRONS	,NULL
1450,DT010ZZ	,1,BEAM RADIATION OF URETER USING PHOTONS <1 MEV	,NULL
1451,DT012ZZ	,1,BEAM RADIATION OF URETER USING PHOTONS >10 MEV	,NULL
1452,DT011ZZ	,1,BEAM RADIATION OF URETER USING PHOTONS 1 - 10 MEV	,NULL
1453,DT033ZZ	,1,BEAM RADIATION OF URETHRA USING ELECTRONS	,NULL
1454,DT033Z0	,1,BEAM RADIATION OF URETHRA USING ELECTRONS; INTRAOPERATIVE	,NULL
1455,DT034ZZ	,1,BEAM RADIATION OF URETHRA USING HEAVY PARTICLES (PROTONS;IONS)	,NULL
1456,DT036ZZ	,1,BEAM RADIATION OF URETHRA USING NEUTRON CAPTURE	,NULL
1457,DT035ZZ	,1,BEAM RADIATION OF URETHRA USING NEUTRONS	,NULL
1458,DT030ZZ	,1,BEAM RADIATION OF URETHRA USING PHOTONS <1 MEV	,NULL
1459,DT032ZZ	,1,BEAM RADIATION OF URETHRA USING PHOTONS >10 MEV	,NULL
1460,DT031ZZ	,1,BEAM RADIATION OF URETHRA USING PHOTONS 1 - 10 MEV	,NULL
1475,DW052ZZ	,1,BEAM RADIATION OF WHOLE BODY USING PHOTONS >10 MEV	,NULL
1492,0GT40ZZ,1,BILATERAL ADRENALECTOMY,NULL
1493,0TT20ZZ	,1,BILATERAL RADICAL NEPHRECTOMY 	,NULL
1494,0UT77ZZ	,1,BILATERAL SALPINGECTOMY,NULL
1495,0VBC0ZZ	,1,BILATERAL SUBCAPSULAR ORCHIDECTOMY,NULL
1496,0FHD4DZ	,1,BILIARY STENTING (PERCUTANEOUS ENDOSCOPIC),NULL
1515,0WBF3ZX	,1,BIOPSY OF ABDOMINAL WALL; PERCUTANEOUS; DIAGNOSTIC,NULL
1516,0DB78ZX	,1,BIOPSY OF ANTRUM ; ENDOSCOPIC; DIAGNOSTIC	,NULL
1517,0CB43ZX	,1,BIOPSY OF CHEEK,NULL
1518,0DBM8ZX	,1,BIOPSY OF DESCENDING COLON; DIAGNOSTIC	,NULL
1519,0DB58ZX	,1,BIOPSY OF ESOPHAGUS,NULL
1520,0CB23ZX	,1,BIOPSY OF HARD PALATE; PERCUTANEOUS; DIAGNOSTIC	,NULL
1521,0DBA8ZX	,1,BIOPSY OF JEJUNUM; ENDOSCOPIC; DIAGNOSTIC	,NULL
1522,07B60ZX	,1,BIOPSY OF LEFT AXILLARY LYMPHATIC; OPEN;DIAGNOSTIC,NULL
1523,04BJ0ZX	,1,"BIOPSY OF LEFT EXTERNAL ILIAC ARTERY;OPEN,DIAGNOST",NULL
1524,0XB93ZX	,1,BIOPSY OF LEFT FOREARM; PERCUTANEOUS; DIAGNOSTIC,NULL
1525,0TB18ZX	,1,BIOPSY OF LEFT KIDNEY; ENDOSCOPIC; DIAGNOSTIC	,NULL
1526,0FB23ZX	,1,BIOPSY OF LEFT LOBE LIVER; PERCUTANEOUS ;DIAGNOSTI,NULL
1527,0BBL3ZX	,1,BIOPSY OF LEFT LUNG; PERCUTANEOUS DIAGNOSTIC	,NULL
1528,0QBP0ZZ	,1,BIOPSY OF LEFT METATARSAL; OPEN APPROACH	,NULL
1529,07B23ZX	,1,BIOPSY OF LEFT NECK LYMPHATIC; PERCUTANEOUS,NULL
1530,04BA0ZX	,1,BIOPSY OF LEFT RENAL ARTERY; OPEN; DIAGNOSTIC,NULL
1531,06BB0ZX	,1,BIOPSY OF LEFT RENAL VEIN; OPEN ; DIAGNOSTIC,NULL
1532,0QBH0ZX	,1,BIOPSY OF LEFT TIBIA; OPEN APPROACH; DIAGNOSTIC	,NULL
1533,0FB00ZX	,1,BIOPSY OF LIVER; OPEN APPROACH; DIAGNOSTIC	,NULL
1534,09BKXZZ	,1,BIOPSY OF NOSE; EXTERNAL APPROACH,NULL
1535,0JBB0ZX	,1,BIOPSY OF PERIANAL SUBCUTANEOUS NODULE ;DIAGNOSTIC,NULL
1536,0DBP8ZX	,1,BIOPSY OF RECTUM;ENDOSCOPIC; DIAGNOSTIC	,NULL
1537,09B0XZX	,1,BIOPSY OF RIGHT EXTERNAL EAR (DIAGNOSTIC)	,NULL
1538,07BH3ZX	,1,BIOPSY OF RIGHT INGUINAL LYMPH NODE;PERCUTANEOUS;D,NULL
1539,0BBK3ZX	,1,BIOPSY OF RIGHT LUNG; DIAGNOSTIC	,NULL
1540,0BBN4ZX	,1,BIOPSY OF RIGHT PLEURA;ENDOSCOPIC ;DIAGNOSTIC,NULL
1541,0TB63ZX	,1,BIOPSY OF RIGHT URETER;DIAGNOSTIC	,NULL
1542,0DB68ZX	,1,BIOPSY OF STOMACH,NULL
1543,0DBC8ZX	,1,BIOPSY OF TERMINAL ILEUM,NULL
1544,0CB73ZX	,1,BIOPSY OF TONGUE; PERCUTANEOUS; DIAGNOSTIC	,NULL
1545,0DB18ZX	,1,BIOPSY OF UPPER ESOPHAGUS,NULL
1546,0UB98ZX	,1,BIOPSY OF UTERUS (ENDOSCOPIC) ; DIAGNOSTIC	,NULL
1547,0HB0XZX	,1,BIOPY OF SCALP SKIN;DIAGNOSTIC	,NULL
1552,0TBB8ZX,1,BLADDER BIOPSY (DIAGNOSTIC),NULL
1553,0T7B8ZZ	,1,BLADDER DISTENTION,NULL
1554,0TQB0ZZ,1,BLADDER REPAIR; OPEN APPROACH,NULL
1555,4A0D8LZ,1,BLADDER VOLUME(CYSTOSCOPIC),NULL
1556,3E1K88Z	,1,BLADDER WASH+CLOTS REMOVAL,NULL
1557,0TBC8ZZ,1,BNI (BLADDER NECK INSCISION),NULL
1558,0T180ZB	,1,BOARI FLAP B/L,NULL
1559,0T170ZB	,1,BOARI FLAP L,NULL
1560,0T160ZB	,1,BOARI FLAP R,NULL
1561,318094,1,BRACHIO/RADIAL BYPASS GRAFTING,NULL
1562,BRT-00007,1,BRACHYTHERAPY 7 SESSION,NULL
1568,0B9L8ZX	,1,"BRONCHIOALVEOLAR LAVAGE,LEFT LUNG",NULL
1569,0B9K8ZX	,1,"BRONCHIOALVEOLAR LAVAGE,RIGHT LUNG",NULL
1570,0B9M8ZX	,1,BRONCHOALVEOLAR LAVAGE ;ENDOSCOPIC; DIAGNOSTIC	,NULL
1571,0B9C8ZX	,1,BRONCHOALVEOLER LAVAGE ; DIAGNOSTIC	,NULL
1572,0BJK8ZZ	,1,BRONCHOSCOPY OF RIGHT LUNG; ENDOSCOPIC,NULL
1573,0QCG0ZZ	,1,BULLET REMOVAL FROM TIBIA BONE,NULL
1574,0D18074,1,BY PAS SMALL INSTESTIN TO CUTANOUS OPEN,NULL
1594,04104Z8	,1,BYPASS ABDOMINAL AORTA TO BILATERAL COMMON ILIAC ARTERIES; PERCUTANEOUS ENDOSCOPIC APPROACH	,NULL
1645,410094,1,"BYPASS ABDOMINAL AORTA TO L RENAL ARTEY, OPEN APRO",NULL
1652,04100J7	,1,BYPASS ABDOMINAL AORTA TO LEFT COMMON ILIAC ARTERY WITH SYNTHETIC SUBSTITUTE; OPEN APPROACH	,
1654,04100Z7	,1,BYPASS ABDOMINAL AORTA TO LEFT COMMON ILIAC ARTERY; OPEN APPROACH	,
1732,04100J6	,1,BYPASS ABDOMINAL AORTA TO RIGHT COMMON ILIAC ARTERY WITH SYNTHETIC SUBSTITUTE; OPEN APPROACH	,NULL
1754,04100ZH	,1,BYPASS ABDOMINAL AORTA TO RIGHT FEMORAL ARTERY; OPEN APPROACH	,NULL
1873,0T180Z8	,1,BYPASS B/L URETERS TO COLON / MENZ II PROCEDURE,NULL
1875,0T1847B	,1,BYPASS BILATERAL URETERS TO BLADDER WITH AUTOLOGOUS TISSUE SUBSTITUTE; PERCUTANEOUS ENDOSCOPIC APPROACH	,NULL
1887,0T180Z9	,1,BYPASS BILATERAL URETERS TO COLOCUTANEOUS; OPEN APPROACH	,
1889,0T18078	,1,BYPASS BILATERAL URETERS TO COLON WITH AUTOLOGOUS TISSUE SUBSTITUTE; OPEN APPROACH	,NULL
1896,0T1847D	,1,BYPASS BILATERAL URETERS TO CUTANEOUS WITH AUTOLOGOUS TISSUE SUBSTITUTE; PERCUTANEOUS ENDOSCOPIC APPROACH	,
1899,0T180JD	,1,BYPASS BILATERAL URETERS TO CUTANEOUS WITH SYNTHETIC SUBSTITUTE; OPEN APPROACH	,NULL
1902,0T184ZD	,1,BYPASS BILATERAL URETERS TO CUTANEOUS; PERCUTANEOUS ENDOSCOPIC APPROACH	,
1903,0T1807C	,1,BYPASS BILATERAL URETERS TO ILEOCUTANEOUS WITH AUTOLOGOUS TISSUE SUBSTITUTE; OPEN APPROACH	,NULL
1904,0T1847C	,1,BYPASS BILATERAL URETERS TO ILEOCUTANEOUS WITH AUTOLOGOUS TISSUE SUBSTITUTE; PERCUTANEOUS ENDOSCOPIC APPROACH	,NULL
1909,0T184ZC	,1,BYPASS BILATERAL URETERS TO ILEOCUTANEOUS; PERCUTANEOUS ENDOSCOPIC APPROACH	,
1910,0T1807A	,1,BYPASS BILATERAL URETERS TO ILEUM WITH AUTOLOGOUS TISSUE SUBSTITUTE; OPEN APPROACH	,NULL
1911,0T1847A	,1,BYPASS BILATERAL URETERS TO ILEUM WITH AUTOLOGOUS TISSUE SUBSTITUTE; PERCUTANEOUS ENDOSCOPIC APPROACH	,NULL
1916,0T180ZA	,1,BYPASS BILATERAL URETERS TO ILEUM; OPEN APPROACH	,NULL
1917,0T184ZA	,1,BYPASS BILATERAL URETERS TO ILEUM; PERCUTANEOUS ENDOSCOPIC APPROACH	,
1966,0T1B079	,1,BYPASS BLADDER TO COLOCUTANEOUS WITH AUTOLOGOUS TISSUE SUBSTITUTE; OPEN APPROACH	,NULL
1974,0T1B47D	,1,BYPASS BLADDER TO CUTANEOUS WITH AUTOLOGOUS TISSUE SUBSTITUTE; PERCUTANEOUS ENDOSCOPIC APPROACH	,NULL
1978,0T1B3JD	,1,BYPASS BLADDER TO CUTANEOUS WITH SYNTHETIC SUBSTITUTE; PERCUTANEOUS APPROACH	,NULL
1979,0T1B4JD	,1,BYPASS BLADDER TO CUTANEOUS WITH SYNTHETIC SUBSTITUTE; PERCUTANEOUS ENDOSCOPIC APPROACH	,NULL
1980,0T1B0ZD,1,BYPASS BLADDER TO CUTANEOUS; OPEN APPROACH	,NULL
1981,0T1B4ZD	,1,BYPASS BLADDER TO CUTANEOUS; PERCUTANEOUS ENDOSCOPIC APPROACH	,NULL
1982,0T1B07C	,1,BYPASS BLADDER TO ILEOCUTANEOUS WITH AUTOLOGOUS TISSUE SUBSTITUTE; OPEN APPROACH	,NULL
1983,0T1B47C	,1,BYPASS BLADDER TO ILEOCUTANEOUS WITH AUTOLOGOUS TISSUE SUBSTITUTE; PERCUTANEOUS ENDOSCOPIC APPROACH	,NULL
1988,0T1B0ZC	,1,BYPASS BLADDER TO ILEOCUTANEOUS; OPEN APPROACH	,NULL
1989,0T1B4ZC	,1,BYPASS BLADDER TO ILEOCUTANEOUS; PERCUTANEOUS ENDOSCOPIC APPROACH	,NULL
2025,0D1H4Z4	,1,BYPASS CECUM TO CUTANEOUS; PERCUTANEOUS ENDOSCOPIC APPROACH	,NULL
2080,16073	,1,BYPASS CEREBRAL VENTRICLE TO BLOOD VESSEL WITH AUTOLOGOUS TISSUE SUBSTITUTE; OPEN APPROACH	,NULL
2118,00160J6	,1,BYPASS CEREBRAL VENTRICLE TO PERITONEAL CAVITY WITH SYNTHETIC SUBSTITUTE; OPEN APPROACH	,
2119,00163J6	,1,BYPASS CEREBRAL VENTRICLE TO PERITONEAL CAVITY WITH SYNTHETIC SUBSTITUTE; PERCUTANEOUS APPROACH	,NULL
2158,0F190Z3	,1,BYPASS COMMON BILE DUCT TO DUODENUM; OPEN APPROACH	,NULL
2159,0F194Z3	,1,BYPASS COMMON BILE DUCT TO DUODENUM; PERCUTANEOUS ENDOSCOPIC APPROACH	,
2170,0F190ZB	,1,BYPASS COMMON BILE DUCT TO SMALL INTESTINE; OPEN APPROACH	,NULL
2171,0F194ZB	,1,BYPASS COMMON BILE DUCT TO SMALL INTESTINE; PERCUTANEOUS ENDOSCOPIC APPROACH	,NULL
2248,02100AW	,1,BYPASS CORONARY ARTERY; ONE SITE FROM AORTA WITH AUTOLOGOUS ARTERIAL TISSUE; OPEN APPROACH	,
2276,02100J9	,1,BYPASS CORONARY ARTERY; ONE SITE FROM LEFT INTERNAL MAMMARY WITH SYNTHETIC SUBSTITUTE; OPEN APPROACH	,
2278,02100Z9	,1,BYPASS CORONARY ARTERY; ONE SITE FROM LEFT INTERNAL MAMMARY; OPEN APPROACH	,
2288,02100Z8	,1,BYPASS CORONARY ARTERY; ONE SITE FROM RIGHT INTERNAL MAMMARY; OPEN APPROACH	,
2376,02110KW	,1,BYPASS CORONARY ARTERY; TWO SITES FROM AORTA WITH NONAUTOLOGOUS TISSUE SUBSTITUTE; OPEN APPROACH	,
2454,0F180ZB	,1,BYPASS CYSTIC DUCT TO SMALL INTESTINE; OPEN APPROACH	,NULL
2460,0D1M074	,1,BYPASS DESCENDING COLON TO CUTANEOUS WITH AUTOLOGOUS TISSUE SUBSTITUTE; OPEN APPROACH	,NULL
2461,0D1M474	,1,BYPASS DESCENDING COLON TO CUTANEOUS WITH AUTOLOGOUS TISSUE SUBSTITUTE; PERCUTANEOUS ENDOSCOPIC APPROACH	,NULL
2470,0D1M0Z4	,1,BYPASS DESCENDING COLON TO CUTANEOUS; OPEN APPROACH	,NULL
2473,0D1M07M	,1,BYPASS DESCENDING COLON TO DESCENDING COLON WITH AUTOLOGOUS TISSUE SUBSTITUTE; OPEN APPROACH	,NULL
2482,0D1M0ZM	,1,BYPASS DESCENDING COLON TO DESCENDING COLON; OPEN APPROACH	,NULL
2483,0D1M4ZM	,1,BYPASS DESCENDING COLON TO DESCENDING COLON; PERCUTANEOUS ENDOSCOPIC APPROACH	,
2486,0D1M47P	,1,BYPASS DESCENDING COLON TO RECTUM WITH AUTOLOGOUS TISSUE SUBSTITUTE; PERCUTANEOUS ENDOSCOPIC APPROACH	,NULL
2497,0D1M07N	,1,BYPASS DESCENDING COLON TO SIGMOID COLON WITH AUTOLOGOUS TISSUE SUBSTITUTE; OPEN APPROACH	,NULL
2505,0D1M8JN	,1,BYPASS DESCENDING COLON TO SIGMOID COLON WITH SYNTHETIC SUBSTITUTE; VIA NATURAL OR ARTIFICIAL OPENING ENDOSCOPIC	,NULL
2507,0D1M4ZN	,1,BYPASS DESCENDING COLON TO SIGMOID COLON; PERCUTANEOUS ENDOSCOPIC APPROACH	,
2508,0D1M8ZN	,1,BYPASS DESCENDING COLON TO SIGMOID COLON; VIA NATURAL OR ARTIFICIAL OPENING ENDOSCOPIC	,NULL
2519,0D190Z4	,1,BYPASS DUODENUM TO CUTANEOUS; OPEN APPROACH	,NULL
2546,0D1907A	,1,BYPASS DUODENUM TO JEJUNUM WITH AUTOLOGOUS TISSUE SUBSTITUTE; OPEN APPROACH	,NULL
2547,0D1947A	,1,BYPASS DUODENUM TO JEJUNUM WITH AUTOLOGOUS TISSUE SUBSTITUTE; PERCUTANEOUS ENDOSCOPIC APPROACH	,NULL
2555,0D190ZA	,1,BYPASS DUODENUM TO JEJUNUM; OPEN APPROACH	,NULL
2556,0D194ZA	,1,BYPASS DUODENUM TO JEJUNUM; PERCUTANEOUS ENDOSCOPIC APPROACH	,
2588,0D150J4	,1,BYPASS ESOPHAGUS TO CUTANEOUS WITH SYNTHETIC SUBSTITUTE; OPEN APPROACH	,NULL
2619,0D1507A	,1,BYPASS ESOPHAGUS TO JEJUNUM WITH AUTOLOGOUS TISSUE SUBSTITUTE; OPEN APPROACH	,NULL
2620,0D1547A	,1,BYPASS ESOPHAGUS TO JEJUNUM WITH AUTOLOGOUS TISSUE SUBSTITUTE; PERCUTANEOUS ENDOSCOPIC APPROACH	,NULL
2628,0D150ZA	,1,BYPASS ESOPHAGUS TO JEJUNUM; OPEN APPROACH	,NULL
2629,0D154ZA	,1,BYPASS ESOPHAGUS TO JEJUNUM; PERCUTANEOUS ENDOSCOPIC APPROACH	,
2638,0D154J6	,1,BYPASS ESOPHAGUS TO STOMACH WITH SYNTHETIC SUBSTITUTE; PERCUTANEOUS ENDOSCOPIC APPROACH	,NULL
2640,0D150Z6	,1,BYPASS ESOPHAGUS TO STOMACH; OPEN APPROACH	,
2641,0D154Z6	,1,BYPASS ESOPHAGUS TO STOMACH; PERCUTANEOUS ENDOSCOPIC APPROACH	,
2657,0F140Z3	,1,BYPASS GALLBLADDER TO DUODENUM; OPEN APPROACH	,NULL
2669,0F140ZB	,1,BYPASS GALLBLADDER TO SMALL INTESTINE; OPEN APPROACH	,NULL
2720,0D1B0ZQ	,1,BYPASS ILEUM TO ANUS; OPEN APPROACH	,
2723,0D1B07K	,1,BYPASS ILEUM TO ASCENDING COLON WITH AUTOLOGOUS TISSUE SUBSTITUTE; OPEN APPROACH	,NULL
2732,0D1B0ZK	,1,BYPASS ILEUM TO ASCENDING COLON; OPEN APPROACH	,NULL
2735,0D1B07H	,1,BYPASS ILEUM TO CECUM WITH AUTOLOGOUS TISSUE SUBSTITUTE; OPEN APPROACH	,NULL
2736,0D1B47H	,1,BYPASS ILEUM TO CECUM WITH AUTOLOGOUS TISSUE SUBSTITUTE; PERCUTANEOUS ENDOSCOPIC APPROACH	,
2744,0D1B0ZH	,1,BYPASS ILEUM TO CECUM; OPEN APPROACH	,NULL
2747,0D1B074	,1,BYPASS ILEUM TO CUTANEOUS WITH AUTOLOGOUS TISSUE SUBSTITUTE; OPEN APPROACH	,NULL
2748,0D1B474	,1,BYPASS ILEUM TO CUTANEOUS WITH AUTOLOGOUS TISSUE SUBSTITUTE; PERCUTANEOUS ENDOSCOPIC APPROACH	,NULL
2749,0D1B874	,1,BYPASS ILEUM TO CUTANEOUS WITH AUTOLOGOUS TISSUE SUBSTITUTE; VIA NATURAL OR ARTIFICIAL OPENING ENDOSCOPIC	,NULL
2753,0D1B0J4	,1,BYPASS ILEUM TO CUTANEOUS WITH SYNTHETIC SUBSTITUTE; OPEN APPROACH	,NULL
2757,0D1B0Z4	,1,BYPASS ILEUM TO CUTANEOUS; OPEN APPROACH	,NULL
2758,0D1B4Z4	,1,BYPASS ILEUM TO CUTANEOUS; PERCUTANEOUS ENDOSCOPIC APPROACH	,NULL
2759,0D1B8Z4	,1,BYPASS ILEUM TO CUTANEOUS; VIA NATURAL OR ARTIFICIAL OPENING ENDOSCOPIC	,
2760,0D1B07M	,1,BYPASS ILEUM TO DESCENDING COLON WITH AUTOLOGOUS TISSUE SUBSTITUTE; OPEN APPROACH	,NULL
2772,0D1B07B	,1,BYPASS ILEUM TO ILEUM WITH AUTOLOGOUS TISSUE SUBSTITUTE; OPEN APPROACH	,NULL
2781,0D1B0ZB	,1,BYPASS ILEUM TO ILEUM; OPEN APPROACH	,NULL
2782,0D1B4ZB	,1,BYPASS ILEUM TO ILEUM; PERCUTANEOUS ENDOSCOPIC APPROACH	,NULL
2793,0D1B0ZP	,1,BYPASS ILEUM TO RECTUM; OPEN APPROACH	,
2794,0D1B4ZP	,1,BYPASS ILEUM TO RECTUM; PERCUTANEOUS ENDOSCOPIC APPROACH	,
2796,0D1B07N	,1,BYPASS ILEUM TO SIGMOID COLON WITH AUTOLOGOUS TISSUE SUBSTITUTE; OPEN APPROACH	,NULL
2803,0D1B4JN	,1,BYPASS ILEUM TO SIGMOID COLON WITH SYNTHETIC SUBSTITUTE; PERCUTANEOUS ENDOSCOPIC APPROACH	,NULL
2805,0D1B0ZN	,1,BYPASS ILEUM TO SIGMOID COLON; OPEN APPROACH	,NULL
2808,0D1B07L	,1,BYPASS ILEUM TO TRANSVERSE COLON WITH AUTOLOGOUS TISSUE SUBSTITUTE; OPEN APPROACH	,NULL
2809,0D1B47L	,1,BYPASS ILEUM TO TRANSVERSE COLON WITH AUTOLOGOUS TISSUE SUBSTITUTE; PERCUTANEOUS ENDOSCOPIC APPROACH	,NULL
2817,0D1B4ZL	,1,BYPASS ILEUM TO TRANSVERSE COLON; PERCUTANEOUS ENDOSCOPIC APPROACH	,
2847,061009Y	,1,BYPASS INFERIOR VENA CAVA TO LOWER VEIN WITH AUTOLOGOUS VENOUS TISSUE; OPEN APPROACH	,NULL
2851,06100JY	,1,BYPASS INFERIOR VENA CAVA TO LOWER VEIN WITH SYNTHETIC SUBSTITUTE; OPEN APPROACH	,
2863,06100J5	,1,BYPASS INFERIOR VENA CAVA TO SUPERIOR MESENTERIC VEIN WITH SYNTHETIC SUBSTITUTE; OPEN APPROACH	,
2913,031209F	,1,BYPASS INNOMINATE ARTERY TO LOWER ARM VEIN WITH AUTOLOGOUS VENOUS TISSUE; OPEN APPROACH	,NULL
2916,03120ZF	,1,BYPASS INNOMINATE ARTERY TO LOWER ARM VEIN; OPEN APPROACH	,NULL
2936,03120Z0	,1,BYPASS INNOMINATE ARTERY TO RIGHT UPPER ARM ARTERY; OPEN APPROACH	,NULL
2946,03120ZD	,1,BYPASS INNOMINATE ARTERY TO UPPER ARM VEIN; OPEN APPROACH	,NULL
3000,0D1A074	,1,BYPASS JEJUNUM TO CUTANEOUS WITH AUTOLOGOUS TISSUE SUBSTITUTE; OPEN APPROACH	,NULL
3006,0D1A0J4	,1,BYPASS JEJUNUM TO CUTANEOUS WITH SYNTHETIC SUBSTITUTE; OPEN APPROACH	,NULL
3007,0D1A3J4	,1,BYPASS JEJUNUM TO CUTANEOUS WITH SYNTHETIC SUBSTITUTE; PERCUTANEOUS APPROACH	,NULL
3008,0D1A4J4	,1,BYPASS JEJUNUM TO CUTANEOUS WITH SYNTHETIC SUBSTITUTE; PERCUTANEOUS ENDOSCOPIC APPROACH	,NULL
3010,0D1A0Z4	,1,BYPASS JEJUNUM TO CUTANEOUS; OPEN APPROACH	,NULL
3025,0D1A07B	,1,BYPASS JEJUNUM TO ILEUM WITH AUTOLOGOUS TISSUE SUBSTITUTE; OPEN APPROACH	,NULL
3036,0D1A07A	,1,BYPASS JEJUNUM TO JEJUNUM WITH AUTOLOGOUS TISSUE SUBSTITUTE; OPEN APPROACH	,NULL
3037,0D1A47A	,1,BYPASS JEJUNUM TO JEJUNUM WITH AUTOLOGOUS TISSUE SUBSTITUTE; PERCUTANEOUS ENDOSCOPIC APPROACH	,NULL
3045,0D1A0ZA	,1,BYPASS JEJUNUM TO JEJUNUM; OPEN APPROACH	,NULL
3046,0D1A4ZA	,1,BYPASS JEJUNUM TO JEJUNUM; PERCUTANEOUS ENDOSCOPIC APPROACH	,NULL
3084,318091,1,"BYPASS L BRACHIAL TO UPPER ARTERY,AUTOLOGOUS,OPEN",NULL
3085,0D1E0Z4,1,BYPASS LARGE INTESTINE TO CUTANEOUS; OPEN APPROACH,NULL
3087,08133J4	,1,BYPASS LEFT ANTERIOR CHAMBER TO SCLERA WITH SYNTHETIC SUBSTITUTE; PERCUTANEOUS APPROACH	,NULL
3088,08133Z4	,1,BYPASS LEFT ANTERIOR CHAMBER TO SCLERA; PERCUTANEOUS APPROACH	,NULL
3158,03160Z1	,1,BYPASS LEFT AXILLARY ARTERY TO LEFT UPPER ARM ARTERY; OPEN APPROACH	,NULL
3165,031609F	,1,BYPASS LEFT AXILLARY ARTERY TO LOWER ARM VEIN WITH AUTOLOGOUS VENOUS TISSUE; OPEN APPROACH	,NULL
3167,03160JF	,1,BYPASS LEFT AXILLARY ARTERY TO LOWER ARM VEIN WITH SYNTHETIC SUBSTITUTE; OPEN APPROACH	,NULL
3168,03160ZF	,1,BYPASS LEFT AXILLARY ARTERY TO LOWER ARM VEIN; OPEN APPROACH	,NULL
3194,03160AD	,1,BYPASS LEFT AXILLARY ARTERY TO UPPER ARM VEIN WITH AUTOLOGOUS ARTERIAL TISSUE; OPEN APPROACH	,NULL
3195,031609D	,1,BYPASS LEFT AXILLARY ARTERY TO UPPER ARM VEIN WITH AUTOLOGOUS VENOUS TISSUE; OPEN APPROACH	,NULL
3197,03160JD	,1,BYPASS LEFT AXILLARY ARTERY TO UPPER ARM VEIN WITH SYNTHETIC SUBSTITUTE; OPEN APPROACH	,NULL
3198,03160ZD	,1,BYPASS LEFT AXILLARY ARTERY TO UPPER ARM VEIN; OPEN APPROACH	,NULL
3199,05180AY	,1,BYPASS LEFT AXILLARY VEIN TO UPPER VEIN WITH AUTOLOGOUS ARTERIAL TISSUE; OPEN APPROACH	,NULL
3203,051809Y	,1,BYPASS LEFT AXILLARY VEIN TO UPPER VEIN WITH AUTOLOGOUS VENOUS TISSUE; OPEN APPROACH	,NULL
3207,05180JY	,1,BYPASS LEFT AXILLARY VEIN TO UPPER VEIN WITH SYNTHETIC SUBSTITUTE; OPEN APPROACH	,NULL
3209,05180ZY	,1,BYPASS LEFT AXILLARY VEIN TO UPPER VEIN; OPEN APPROACH	,NULL
3211,051C0AY	,1,BYPASS LEFT BASILIC VEIN TO UPPER VEIN WITH AUTOLOGOUS ARTERIAL TISSUE; OPEN APPROACH	,NULL
3213,051C07Y	,1,BYPASS LEFT BASILIC VEIN TO UPPER VEIN WITH AUTOLOGOUS TISSUE SUBSTITUTE; OPEN APPROACH	,NULL
3215,051C09Y	,1,BYPASS LEFT BASILIC VEIN TO UPPER VEIN WITH AUTOLOGOUS VENOUS TISSUE; OPEN APPROACH	,NULL
3219,051C0JY	,1,BYPASS LEFT BASILIC VEIN TO UPPER VEIN WITH SYNTHETIC SUBSTITUTE; OPEN APPROACH	,NULL
3221,051C0ZY	,1,BYPASS LEFT BASILIC VEIN TO UPPER VEIN; OPEN APPROACH	,NULL
3231,03180J1	,1,BYPASS LEFT BRACHIAL ARTERY TO LEFT UPPER ARM ARTERY WITH SYNTHETIC SUBSTITUTE; OPEN APPROACH	,NULL
3232,03180Z1	,1,BYPASS LEFT BRACHIAL ARTERY TO LEFT UPPER ARM ARTERY; OPEN APPROACH	,NULL
3233,03180AF	,1,BYPASS LEFT BRACHIAL ARTERY TO LOWER ARM VEIN WITH AUTOLOGOUS ARTERIAL TISSUE; OPEN APPROACH	,NULL
